{
 "description": "timing probe mult_r0_r1 in FP32",
 "format": "fp32",
 "emulator_only": true,
 "max_cycles": 1000,
 "fault_enables": {},
 "registers": [
  {
   "name": "r_wide_debug",
   "index": 0,
   "hex": "0000803f0000803f0000803f0000803f0000803f0000803f0000803f0000803f0000803f0000803f0000803f0000803f0000803f0000803f0000803f0000803f0000803f0000803f0000803f0000803f0000803f0000803f0000803f0000803f0000803f0000803f0000803f0000803f0000803f0000803f0000803f0000803f0000803f0000803f0000803f0000803f0000803f0000803f0000803f0000803f0000803f0000803f0000803f0000803f0000803f0000803f0000803f0000803f0000803f0000803f0000803f0000803f0000803f0000803f0000803f0000803f0000803f0000803f0000803f0000803f0000803f0000803f0000803f0000803f0000803f0000803f0000803f0000803f0000803f0000803f0000803f0000803f0000803f0000803f0000803f0000803f0000803f0000803f0000803f0000803f0000803f0000803f0000803f0000803f0000803f0000803f0000803f0000803f0000803f0000803f0000803f0000803f0000803f0000803f0000803f0000803f0000803f0000803f0000803f0000803f0000803f0000803f0000803f0000803f0000803f0000803f0000803f0000803f0000803f0000803f0000803f0000803f0000803f0000803f0000803f0000803f0000803f0000803f0000803f0000803f0000803f0000803f0000803f0000803f0000803f0000803f0000803f0000803f"
  },
  {
   "name": "cr",
   "index": 2,
   "value": 16
  }
 ],
 "xmem": [
  {
   "address": 8195,
   "hex": "4000000040000000400000004000000040000000400000004000000040000000400000004000000040000000400000004000000040000000400000004000000040000000400000004000000040000000400000004000000040000000400000004000000040000000400000004000000040000000400000004000000040000000400000004000000040000000400000004000000040000000400000004000000040000000400000004000000040000000400000004000000040000000400000004000000040000000400000004000000040000000400000004000000040000000400000004000000040000000400000004000000040000000400000004000000040000000400000004000000040000000400000004000000040000000400000004000000040000000400000004000000040000000400000004000000040000000400000004000000040000000400000004000000040000000400000004000000040000000400000004000000040000000400000004000000040000000400000004000000040000000400000004000000040000000400000004000000040000000400000004000000040000000400000004000000040000000400000004000000040000000400000004000000040000000400000004000000040000000400000004000000040000000400000004000000040000000400000004000000040"
  }
 ]
}
