{
 "description": "timing probe signed_bge in NX8",
 "format": "nx8",
 "emulator_only": false,
 "max_cycles": 1000,
 "fault_enables": {},
 "registers": [
  {
   "name": "r_mask",
   "index": 0,
   "hex": "ffffffffffffffffffffffffffffffffffffffffffffffffffffffffffffffffffffffffffffffffffffffffffffffffffffffffffffffffffffffffffffffffffffffffffffffffffffffffffffffffffffffffffffffffffffffffffffffffffffffffffffffffffffffffffffffffffffffffffffffffffffffffffffffff"
  },
  {
   "name": "cr",
   "index": 2,
   "value": 4294967295
  },
  {
   "name": "cr",
   "index": 3,
   "value": 1
  },
  {
   "name": "cr",
   "index": 4,
   "value": 2
  },
  {
   "name": "cr",
   "index": 14,
   "value": 328
  },
  {
   "name": "cr",
   "index": 15,
   "value": 4224
  }
 ],
 "xmem": []
}
