{
 "description": "timing probe acc_mult_res_add in NX8",
 "format": "nx8",
 "emulator_only": false,
 "max_cycles": 1000,
 "fault_enables": {},
 "registers": [
  {
   "name": "r_cyclic",
   "index": 0,
   "hex": "0404040404040404040404040404040404040404040404040404040404040404040404040404040404040404040404040404040404040404040404040404040404040404040404040404040404040404040404040404040404040404040404040404040404040404040404040404040404040404040404040404040404040404000000000000000000000000000000000000000000000000000000000000000000000000000000000000000000000000000000000000000000000000000000000000000000000000000000000000000000000000000000000000000000000000000000000000000000000000000000000000000000000000000000000000000000000000000000000000000000000000000000000000000000000000000000000000000000000000000000000000000000000000000000000000000000000000000000000000000000000000000000000000000000000000000000000000000000000000000000000000000000000000000000000000000000000000000000000000000000000000000000000000000000000000000000000000000000000000000000000000000000000000000000000000000000000000000000000000000000000000000000000000000000000000000000000000000000000000000000000000000000000000000000000000000000000000000000000000000000000000"
  },
  {
   "name": "r_cyclic_meta",
   "index": 0,
   "hex": "8000"
  },
  {
   "name": "r_mask",
   "index": 0,
   "hex": "ffffffffffffffffffffffffffffffffffffffffffffffffffffffffffffffffffffffffffffffffffffffffffffffffffffffffffffffffffffffffffffffffffffffffffffffffffffffffffffffffffffffffffffffffffffffffffffffffffffffffffffffffffffffffffffffffffffffffffffffffffffffffffffffff"
  },
  {
   "name": "cr",
   "index": 14,
   "value": 328
  },
  {
   "name": "cr",
   "index": 15,
   "value": 4224
  },
  {
   "name": "mult_res",
   "index": 0,
   "hex": "0000803f0000803f0000803f0000803f0000803f0000803f0000803f0000803f0000803f0000803f0000803f0000803f0000803f0000803f0000803f0000803f0000803f0000803f0000803f0000803f0000803f0000803f0000803f0000803f0000803f0000803f0000803f0000803f0000803f0000803f0000803f0000803f0000803f0000803f0000803f0000803f0000803f0000803f0000803f0000803f0000803f0000803f0000803f0000803f0000803f0000803f0000803f0000803f0000803f0000803f0000803f0000803f0000803f0000803f0000803f0000803f0000803f0000803f0000803f0000803f0000803f0000803f0000803f0000803f0000803f0000803f0000803f0000803f0000803f0000803f0000803f0000803f0000803f0000803f0000803f0000803f0000803f0000803f0000803f0000803f0000803f0000803f0000803f0000803f0000803f0000803f0000803f0000803f0000803f0000803f0000803f0000803f0000803f0000803f0000803f0000803f0000803f0000803f0000803f0000803f0000803f0000803f0000803f0000803f0000803f0000803f0000803f0000803f0000803f0000803f0000803f0000803f0000803f0000803f0000803f0000803f0000803f0000803f0000803f0000803f0000803f0000803f0000803f0000803f0000803f0000803f0000803f0000803f"
  }
 ],
 "xmem": []
}
