{
 "description": "MULT.RC.VE in INT8",
 "format": "int8",
 "emulator_only": false,
 "max_cycles": 1000,
 "fault_enables": {},
 "registers": [
  {
   "name": "r",
   "index": 0,
   "hex": "db6c85512341aff7f8020c865679407627eefdb6f41b09d86c9bb1e0c57f36617fc8997bae87ca0699cdab45aedf701e171c1e8ca6ce4a0553daa147da217f2717fdb7f59880f0083d1ef6f35853db52f0743cce2455c2ddf38e480da7b52f506b8353e3c2ca445c660081ff49143cdf0c68cbdbc66edbc6b49d8e3afeff1843"
  },
  {
   "name": "r",
   "index": 1,
   "hex": "22a9bd5a18f8f1ae4b16f65b2d73218ac83bb759c1d7b35f6e4d3e30d0628581ccc93a5578547b229c1392152ef8fcdc7d08b2929b3cc1cc0f9304f1d88b6d69eaffc2c732219b36f86a02c6a922c6afec553e76da61405e15eba134c50a131c28a4698fb8177b0f394a82852982a37db91c1676fd06ded9dd26a171ad695699"
  },
  {
   "name": "r_cyclic",
   "index": 0,
   "hex": "f2fb3b758449dd39092a33d649a175649163be9103e94a244bf929f1c4a52936d8797da4d5ded77381dbb586d92201554ebabc56d9e4fa6a226482c3de57b68561585714056907d08087adb04250cca156c71ab38e3e18320e631f05305c8f228148c2591da6018804a53d91f1ccb008e4a468273e2c8e2439fd26b8f7004b32ebd419967a0cc4ba1d3e5dd5fee50adae8628d050f20af0e95d642be48486418abbad1c06051a456e5594fc7c9a601da17701a743c1c700335c800f0fefbdced10f76dbd549a495ec0224b53be2332638d04852841b8997c8ae2f601c7a5eb107cf4a5998bdd1e21088de5c325542bc9fd297c230eb63cdcd08064b2093301b124275117f5095853b227a48c144c57fbf2eac5ac60c39cbd4055a251cfcaeec369c334f6e721b68a3103a018c00bb0d1dc2852d98cbf5e0eea3ef1b8c8f725942791de32040ac1a5137678c966c397cab16fdf9e741425dd9a68b492d321adfa6abb6d2a5180666d50936207f08ae537a2b7c0e91a3e6b3d7c437a89c12b7a8be4757698c16785caedf8fb7bc43d12081a6b0c7cfe0c2df684240a895a5b9f584f56f90240c9adaf50ea68c1043473b81dee413088fb1c4b93965dceac0e7a279f4e78390f1ddbb321bf2d82ce9b2eeb8c3e6a9ee04e014eb610cc52f439618c83e810c2f865a9f7d7be59bf9f1aa5e1f54a10cb9876d9a11c14394966adbd7b"
  },
  {
   "name": "r_mask",
   "index": 0,
   "hex": "808de360a67911d59761688c6b639325ad5f99473dcb511cf1a552157e0dc7ecfdfd122ddf6bf008e188440dff978e17658a550afb642cf83da1f9dea59d702f6aebbec1c7ea04ab4cffd35faa97baecf193c065d854f8f79e500e3ed9089546dd17d2252d5e7642b85481681ba3871e7670fe4e05e90b72a3eee6381509dfaf"
  },
  {
   "name": "lr",
   "index": 1,
   "value": 1
  },
  {
   "name": "lr",
   "index": 2,
   "value": 2
  },
  {
   "name": "lr",
   "index": 3,
   "value": 3
  },
  {
   "name": "lr",
   "index": 4,
   "value": 5
  },
  {
   "name": "lr",
   "index": 6,
   "value": 128
  },
  {
   "name": "lr",
   "index": 7,
   "value": 3
  },
  {
   "name": "cr",
   "index": 2,
   "value": 1
  },
  {
   "name": "cr",
   "index": 3,
   "value": 4
  },
  {
   "name": "cr",
   "index": 4,
   "value": 2
  },
  {
   "name": "cr",
   "index": 5,
   "value": 7
  },
  {
   "name": "cr",
   "index": 6,
   "value": 128
  },
  {
   "name": "cr",
   "index": 7,
   "value": 4294967294
  },
  {
   "name": "cr",
   "index": 8,
   "value": 100
  },
  {
   "name": "cr",
   "index": 9,
   "value": 3
  }
 ],
 "xmem": []
}
