{
 "description": "AGG.MAX.FIRST in FP32",
 "format": "fp32",
 "emulator_only": true,
 "max_cycles": 1000,
 "fault_enables": {},
 "registers": [
  {
   "name": "lr",
   "index": 1,
   "value": 1
  },
  {
   "name": "lr",
   "index": 2,
   "value": 2
  },
  {
   "name": "lr",
   "index": 3,
   "value": 3
  },
  {
   "name": "lr",
   "index": 4,
   "value": 5
  },
  {
   "name": "lr",
   "index": 6,
   "value": 128
  },
  {
   "name": "lr",
   "index": 7,
   "value": 3
  },
  {
   "name": "cr",
   "index": 2,
   "value": 1
  },
  {
   "name": "cr",
   "index": 3,
   "value": 4
  },
  {
   "name": "cr",
   "index": 4,
   "value": 2
  },
  {
   "name": "cr",
   "index": 5,
   "value": 7
  },
  {
   "name": "cr",
   "index": 6,
   "value": 128
  },
  {
   "name": "cr",
   "index": 7,
   "value": 4294967294
  },
  {
   "name": "cr",
   "index": 8,
   "value": 100
  },
  {
   "name": "cr",
   "index": 9,
   "value": 3
  },
  {
   "name": "mult_res",
   "index": 0,
   "hex": "85479fbfbfd87fbfa15c2240d802b6c01be0d1c0778acf3f7c51fb40202e933f93cca540c151b0c09421b0c08dbef04020a2cf3ec7627140ffa9993ea7117d405f8f70c015b4dd40bf902fc04b1ad6c0052a9a40bac329400b106ac0422bfac089b21640b58c0bc096017440e012b5c0445bc140258379be0cdfd3c0aa58d3bea31de8bfe8218740984ca140b17ab940a07e02c01aad79bffb517540277607bf5ee283c08e34dcc0bfaaf74060c5a7bec4b596c02017efbf231b87c0627bc840b00cdfc0c8cda2c01908f7c088d4c54046aea54004f5efc07284623f85304fc03be01fbf29cf4f3f804847404373bc40403c8ec04f91c5c0a95f8b3fff2c25bd3c99574046a02ac05cdceac0fe19acbfa9ba5fbf7584f44074945dc0a3f7c8c0448a45c0150591c077fccec064440540492e2c4013f98cc0595dfac05291dac0bafeb53f4de7fcbf4feef5c0891d0f4048901abfe5f6a33f09ea443fa93d5f3f75d08bc049e448c0ed08adbe8ed130c0a520b0402d0b373fb5529a40740586c09daa0a3fa823f7bf9c00994065f1963f415cebc0b6ecc5c0f3066ac0bc7a2b3f2796da405f1a48405307a140810fe33f45bd1d403ddcd7c02c3e3040d8402ec07459b8bf9d11a2c06ebdb640db21b2405cfa3740435847bd266f4d3e6f0887c0e076bec0fdf9bac0c9ac893fa85add3f158c8940c96395405f3d013ca99e60c0"
  }
 ],
 "xmem": []
}
