{
 "description": "timing probe mult_r_mask_next_word in FP32",
 "format": "fp32",
 "emulator_only": true,
 "max_cycles": 1000,
 "fault_enables": {},
 "registers": [
  {
   "name": "r_cyclic_wide_debug",
   "index": 0,
   "hex": "0000404000004040000040400000404000004040000040400000404000004040000040400000404000004040000040400000404000004040000040400000404000004040000040400000404000004040000040400000404000004040000040400000404000004040000040400000404000004040000040400000404000004040000040400000404000004040000040400000404000004040000040400000404000004040000040400000404000004040000040400000404000004040000040400000404000004040000040400000404000004040000040400000404000004040000040400000404000004040000040400000404000004040000040400000404000004040000040400000404000004040000040400000404000004040000040400000404000004040000040400000404000004040000040400000404000004040000040400000404000004040000040400000404000004040000040400000404000004040000040400000404000004040000040400000404000004040000040400000404000004040000040400000404000004040000040400000404000004040000040400000404000004040000040400000404000004040000040400000404000004040000040400000404000004040000040400000404000004040000040400000404000004040000040400000404000004040000040400000404000004040000000000000000000000000000000000000000000000000000000000000000000000000000000000000000000000000000000000000000000000000000000000000000000000000000000000000000000000000000000000000000000000000000000000000000000000000000000000000000000000000000000000000000000000000000000000000000000000000000000000000000000000000000000000000000000000000000000000000000000000000000000000000000000000000000000000000000000000000000000000000000000000000000000000000000000000000000000000000000000000000000000000000000000000000000000000000000000000000000000000000000000000000000000000000000000000000000000000000000000000000000000000000000000000000000000000000000000000000000000000000000000000000000000000000000000000000000000000000000000000000000000000000000000000000000000000000000000000000000000000000000000000000000000000000000000000000000000000000000000000000000000000000000000000000000000000000000000000000000000000000000000000000000000000000000000000000000000000000000000000000000000000000000000000000000000000000000000000000000000000000000000000000000000000000000000000000000000000000000000000000000000000000000000000000000000000000000000000000000000000000000000000000000000000000000000000000000000000000000000000000000000000000000000000000000000000000000000000000000000000000000000000000000000000000000000000000000000000000000000000000000000000000000000000000000000000000000000000000000000000000000000000000000000000000000000000000000000000000000000000000000000000000000000000000000000000000000000000000000000000000000000000000000000000000000000000000000000000000000000000000000000000000000000000000000000000000000000000000000000000000000000000000000000000000000000000000000000000000000000000000000000000000000000000000000000000000000000000000000000000000000000000000000000000000000000000000000000000000000000000000000000000000000000000000000000000000000000000000000000000000000000000000000000000000000000000000000000000000000000000000000000000000000000000000000000000000000000000000000000000000000000000000000000000000000000000000000000000000000000000000000000000000000000000000000000000000000000000000000000000000000000000000000000000000000000000000000000000000000000000000000000000000000000000000000000000000000000000000000000000000000000000000000000000000000000000000000000000000000000000000000000000000000000000000000000000000000000000000000000000000000000000000000000000000000000000000000000000000000000000000000000000000000000000000000000000000000000000000000000000000000000000000000000000000000000000000000000000000000000000000000000000000000000000000000000000000000000000000000000000000000000000000000000000000000000000000000000000000000000000000000000000000000000000000000000000000000000000000000000000000000000000000000000000000000000000000000000000000000000000000000000000000000000000000000000000000000000000000000000000000000000000000000000000000000000000000000000000000000000000000000000000000000000000000000000000000000000000000000000000000000000000000000000000000000000000000000000000000000000000000000000000000000000000000000000000000000000000000000000000000000000000000"
  },
  {
   "name": "cr",
   "index": 2,
   "value": 16
  }
 ],
 "xmem": []
}
