{
 "description": "AGG.SUM.FIRST in E4",
 "format": "e4",
 "emulator_only": false,
 "max_cycles": 1000,
 "fault_enables": {},
 "registers": [
  {
   "name": "r_mask",
   "index": 0,
   "hex": "ffffffffffffffffffffffffffffffffffffffffffffffffffffffffffffffffffffffffffffffffffffffffffffffffffffffffffffffffffffffffffffffffffffffffffffffffffffffffffffffffffffffffffffffffffffffffffffffffffffffffffffffffffffffffffffffffffffffffffffffffffffffffffffffff"
  },
  {
   "name": "lr",
   "index": 1,
   "value": 1
  },
  {
   "name": "lr",
   "index": 2,
   "value": 2
  },
  {
   "name": "lr",
   "index": 3,
   "value": 3
  },
  {
   "name": "lr",
   "index": 4,
   "value": 5
  },
  {
   "name": "lr",
   "index": 6,
   "value": 128
  },
  {
   "name": "lr",
   "index": 7,
   "value": 3
  },
  {
   "name": "cr",
   "index": 2,
   "value": 1
  },
  {
   "name": "cr",
   "index": 3,
   "value": 4
  },
  {
   "name": "cr",
   "index": 4,
   "value": 2
  },
  {
   "name": "cr",
   "index": 5,
   "value": 7
  },
  {
   "name": "cr",
   "index": 6,
   "value": 128
  },
  {
   "name": "cr",
   "index": 7,
   "value": 4294967294
  },
  {
   "name": "cr",
   "index": 8,
   "value": 100
  },
  {
   "name": "cr",
   "index": 9,
   "value": 3
  },
  {
   "name": "cr",
   "index": 15,
   "value": 128
  },
  {
   "name": "mult_res",
   "index": 0,
   "hex": "65539dc037217a40ad282d40cea3b640dfaaadc086faba400860e4c09fe0b0c013fe9340ee122b3fef3be5c04c562140730296bf81adf2c031f1bf40a23d77c0194861c0b9c44fc08159ecc0b636f1400af999c05edefabf0409c2bfb172bd40254648c0e323d5404ef86e402ab89740b8a3cc405dbad3c073b3ccbf6af40fbfec1cb0bf3a6ef7bd3f40bd40e84772c009768bc05ca98ebf8aa4ccbdb2adc040496ce440fbb6a0bd775ec94063a3b4c08977cbc0071c2ec07a4fbcc07f94973eb5820440a4fa43c018289dc0fc03f040521eaec037cfa83fcdce7d40cfeffc3f91d81f4072b9b4c0134649c0cb6d9cc01ab48d401ee4003f394be8405f8d8ac09ad844c004749e4066f4f23f181eb940e794d240385487c0c6ef4a405b5bedc0e3f8f6bfa65fc43f4570ecc0d4abc33d3e50eec0d6dc7840e2cdf4c0654283c0bdafd0bfae1f8740d2c3c440f15d58407e03b440764a8140f43fd8be011504c073c0cb3fe60f54c012a87b40b6525bc00ee6833fa2b547c03d7ebf4044aeaa403ceb8e3f2df939c0c26d72c0df81f7bfa8fc1bc0f66875401a0eb6c0e93ad83f54a91d3fe20183404326b04095bd874016f2acc06678d1400108b93f3b2fa83e1c7b92c00d453bbef70313c076fda1c0cbe6aa400efa9e3fda35c83fc99ed1bff8b99cbf71e08e402c0ba6c0781dad403cc240c0c508a0c07a3c4fc05d1e03c0"
  }
 ],
 "xmem": []
}
