{
 "description": "ACC.SUB in E4",
 "format": "e4",
 "emulator_only": false,
 "max_cycles": 1000,
 "fault_enables": {},
 "registers": [
  {
   "name": "r_acc",
   "index": 0,
   "hex": "3d428840213271bf3335f24041af12bf0cfc49c07eeeb8c0e0f7ac40611c4840a4ad94bf3b3f3940bd38b3c0cdabe2c0de005540e960473e6a84debf634abd3f2b79abc06a9aa5bfc1bdbabfa0dbd3c0466430c074c151c0a904edc028cb5c4043e9da3f39bed9bf509ac6403f129bc09fe1a14014435cc0c727dbc0b97de3c0abb2db40de7121c0c6f4f8c0fd48c540dd45e63ea576a03fff15a2bfe78699c08896103fb3cbd9c060f41540d19ef540913a4cc05d9ba5c0d393aebfbdbd63402cb53ac0d5a5bec01580f740c0a3f9406302fdc044a76d40e8f667c072893cbb0567e740658bdfc01562fbc0870b73bf9ee2c2c05b829740f03cbf40682aaac0d0dc6cc06b52da3fd226df4052f978c05462de40ff02adbff3dbc3407689433e236366c063798040d673fb409411c63fb0df96400e98f840dae50840073c813feaf71ec0e4a5f83f29e0adbf6efee5bfb04dbb40b760584053c84940f8a1b5c053d28bc068dbe640775c88c03ddcec40c160a94075751c40ccddac40921ed8c0656a0840ec42a4be92f155400a555fc03803ff4009e3bd40625f40c0fd0398c0436d4cc0a08bd540bd30f3c0ddccc4bfcfa7a7408760d1c0d30497c0aadf14c0a07759c024635e40dc9eedc070fd9ac00151c040eeb8e440c4359bc03ee8d640a4fbda409664b540e5153f401770f4409b1f6cc07c1f8a40a8a7edc0c9acb2bf"
  },
  {
   "name": "lr",
   "index": 1,
   "value": 1
  },
  {
   "name": "lr",
   "index": 2,
   "value": 2
  },
  {
   "name": "lr",
   "index": 3,
   "value": 3
  },
  {
   "name": "lr",
   "index": 4,
   "value": 5
  },
  {
   "name": "lr",
   "index": 6,
   "value": 128
  },
  {
   "name": "lr",
   "index": 7,
   "value": 3
  },
  {
   "name": "cr",
   "index": 2,
   "value": 1
  },
  {
   "name": "cr",
   "index": 3,
   "value": 4
  },
  {
   "name": "cr",
   "index": 4,
   "value": 2
  },
  {
   "name": "cr",
   "index": 5,
   "value": 7
  },
  {
   "name": "cr",
   "index": 6,
   "value": 128
  },
  {
   "name": "cr",
   "index": 7,
   "value": 4294967294
  },
  {
   "name": "cr",
   "index": 8,
   "value": 100
  },
  {
   "name": "cr",
   "index": 9,
   "value": 3
  },
  {
   "name": "mult_res",
   "index": 0,
   "hex": "8e4bfdc06343eac0156caebfd847243d9663ba3f162babc018cfbd40d563d540fed62dbf771eec403b69223e1683aa40380585bef9443940ce0e884006f9ab401a5292c0cf4ecac0fa60914089d2e140ebcc38c0a6a5c940dd259e40162113c0ffc1d63c7aa9314020939040a194e13ff56a9040102b754027a3d740ccd1dabf7773e0c00219a9bfe1308dbf52bea64092de4f3d9b8df340184580c0285d0cc0975ef940796682c09d6f7740caa6b640c9253dbf783c97be5aabc5c0908215bf99d1f63f5ff0d5bff00938bf5901a54075dda8c019349040f9305840e7c01ec0b6ac66c0a2bcba402cceeebf7de38abf65d88140745a67c090155bc059a3b23fcce19d402023c43fc558cbc0fd2cdf405fce8d409acae840778e93bf650c07c0cdbb08409b8facc07a524bc0730bf140f3f703bfa099e6c01ea1bdbf42aedec011eef0c0a1870540bde85fc0d99d85c0e27707407029e9406483f3407974f7bd94726f40ed1969c02ea382c0836870c00840893fb043c7403b5fdd409f55c23bc840df40361861c06faa894089ebfc40db763fc039c4ac3f7cdef94033db263fe60bf84097029d3f6e78fc400da304be04288bbe62759040accd804062f86540945403bd88d31cbd0fb39f406b0b1fbff09a25c03b75a0c023b1b1c0846634be9228c33ff56275c0df12cbbf44f03940a1f486c06bf4fdbf7191b6c047027840"
  }
 ],
 "xmem": []
}
